Name,Industry,Tier,Website,Relationship Owner,Notes
Acme Corp,Manufacturing,CHAMPION,https://acme.com,Jane Smith,Long-time advocate. Happy to do case studies.
Beta Solutions,Software,ADVOCATE,https://betasolutions.io,Mike Chen,Interested in speaking at next summit.
Gamma Health,Healthcare,REFERENCE,https://gammahealth.com,Sarah Lee,Approved for 1-page reference only.
Delta Finance,Financial Services,PROSPECT,https://deltafinance.com,Tom Brown,Evaluating Q2 expansion. Follow up April.
Epsilon Retail,Retail,PROSPECT,https://epsilonretail.com,,New logo from last month.
